<?xml version="1.0" encoding="utf-8"?>

<orarend xmlns:xsi="http://www.w3.org/2001/XMLSchema-instance"
			 xsi:noNamespaceSchemaLocation="ZSN_orarend1.xsd">

	<ora id="1" tipus="gyakorlat" >
		<targy nev="Automaták és formális nyelvek"/>
		<idopont >

			<nap>Hétfo</nap>
			<tol>16:00</tol>
			<ig>18:00</ig>
		</idopont>
		<helyszin>XII előadó</helyszin>
		<oktato nev="Veres Laura"/>
		<szak>Programtervező</szak>

	</ora>

	<ora id="2" tipus="gyakorlat" >
		<targy nev="Adatkezelés XML-ben"/>
		<idopont >

			<nap>Kedd</nap>
			<tol>12:00</tol>
			<ig>16:00</ig>
		</idopont>
		<helyszin>I előadó</helyszin>
		<oktato nev="Bednarik László"/>
		<szak>Programtervező</szak>

	</ora>

	<ora id="3" tipus="elmelet" >
		<targy nev="Vállalati információs rendszerek fejlesztése"/>
		<idopont >

			<nap>Szerda</nap>
			<tol>16:00</tol>
			<ig>20:00</ig>
		</idopont>
		<helyszin>IX előadó</helyszin>
		<oktato nev="Dr. Sasvári Péter László"/>
		<szak>Programtervező</szak>
	</ora>

	<ora id="4" tipus="elmelet" >
		<targy nev="Szakdolgozatkészítés I."/>
		<idopont >
			<nap>Csutortok</nap>
			<tol>16:00</tol>
			<ig>17:00</ig>
		</idopont>
		<helyszin>I előadó</helyszin>
		<oktato nev="Karácsony Zsolt "/>
		<szak>Programtervező</szak>
	</ora>

	<ora id="5" tipus="gyakorlat" >
		<targy nev="Testnevelés I."/>
		<idopont >
			<nap>Pentek</nap>
			<tol>10:00</tol>
			<ig>18:00</ig>
		</idopont>
		<helyszin>UFO</helyszin> 
		<oktato nev="Minta Aladár"/>
		<szak>Programtervező</szak>

	</ora>



</orarend>
